UC1 CREATE ADDRESS BOOK DATABASE
mysql> CREATE database AddressBook_System;
Query OK, 1 row affected (0.66 sec)

mysql> show databases;
+---------------------+
| Database            |
+---------------------+
| addressbook_service |
| addressbook_system  |
| information_schema  |
| mysql               |
| payroll_service     |
| performance_schema  |
| sys                 |
+---------------------+
7 rows in set (0.75 sec)

UC2 CREATE ADDRESS BOOK TABLE

mysql> CREATE TABLE addressbook_system
    -> (
    -> FirstName        VARCHAR(150) NOT NULL,
    -> LastName         VARCHAR(150) NOT NULL,
    -> Address          VARCHAR(150) NOT NULL,
    -> City             VARCHAR(150) NOT NULL,
    -> State            VARCHAR(150) NOT NULL,
    -> Zip              INT NOT NULL,
    -> PhoneNo          VARCHAR(15) NOT NULL,
    -> Email            VARCHAR(150) NOT NULL
    -> );
Query OK, 0 rows affected (2.80 sec)

mysql> DESCRIBE addressbook_system;
+-----------+--------------+------+-----+---------+-------+
| Field     | Type         | Null | Key | Default | Extra |
+-----------+--------------+------+-----+---------+-------+
| FirstName | varchar(150) | NO   |     | NULL    |       |
| LastName  | varchar(150) | NO   |     | NULL    |       |
| Address   | varchar(150) | NO   |     | NULL    |       |
| City      | varchar(150) | NO   |     | NULL    |       |
| State     | varchar(150) | NO   |     | NULL    |       |
| Zip       | int          | NO   |     | NULL    |       |
| PhoneNo   | varchar(15)  | NO   |     | NULL    |       |
| Email     | varchar(150) | NO   |     | NULL    |       |
+-----------+--------------+------+-----+---------+-------+
8 rows in set (0.29 sec)

UC3 INSERT NEW CONTACT

mysql> INSERT INTO addressbook_system (FirstName, LastName, Address, City, State, Zip, PhoneNo, Email) VALUES
    -> ( 'Amit','Sharma','Street23','Chandigarh','Punjab',400001,946789912,'amit@gmail'),
    -> ('Shourya','Sharma','Street24','Pune','Maharastra',400002,987654320,'shourya@gmail.com'),
    -> ('Shashank','Tiwari','Street35','Mumbai','Maharastra',400003,98765432,'shashank@gmail.com');
Query OK, 3 rows affected (0.57 sec)
Records: 3  Duplicates: 0  Warnings: 0

mysql> SELECT * FROM addressbook_system;
+-----------+----------+----------+------------+------------+--------+-----------+--------------------+
| FirstName | LastName | Address  | City       | State      | Zip    | PhoneNo   | Email              |
+-----------+----------+----------+------------+------------+--------+-----------+--------------------+
| Amit      | Sharma   | Street23 | Chandigarh | Punjab     | 400001 | 946789912 | amit@gmail         |
| Shourya   | Sharma   | Street24 | Pune       | Maharastra | 400002 | 987654320 | shourya@gmail.com  |
| Shashank  | Tiwari   | Street35 | Mumbai     | Maharastra | 400003 | 98765432  | shashank@gmail.com |
+-----------+----------+----------+------------+------------+--------+-----------+--------------------+
3 rows in set (0.04 sec)

UC4 EDIT CONTACTS

mysql> UPDATE addressbook_system
    -> SET City='Amritsar', Address='Street12'
    -> WHERE FirstName='Amit';
Query OK, 1 row affected (0.23 sec)
Rows matched: 1  Changed: 1  Warnings: 0

mysql> SELECT * FROM addressbook_system;
+-----------+----------+----------+----------+------------+--------+-----------+--------------------+
| FirstName | LastName | Address  | City     | State      | Zip    | PhoneNo   | Email              |
+-----------+----------+----------+----------+------------+--------+-----------+--------------------+
| Amit      | Sharma   | Street12 | Amritsar | Punjab     | 400001 | 946789912 | amit@gmail         |
| Shourya   | Sharma   | Street24 | Pune     | Maharastra | 400002 | 987654320 | shourya@gmail.com  |
| Shashank  | Tiwari   | Street35 | Mumbai   | Maharastra | 400003 | 98765432  | shashank@gmail.com |
+-----------+----------+----------+----------+------------+--------+-----------+--------------------+
3 rows in set (0.05 sec)

UC5 DELETE CONTACT OF A PERSON

mysql> DELETE FROM addressbook_system WHERE FirstName='Amit';
Query OK, 1 row affected (0.12 sec)

mysql> SELECT * FROM addressbook_system;
+-----------+----------+----------+--------+------------+--------+-----------+--------------------+
| FirstName | LastName | Address  | City   | State      | Zip    | PhoneNo   | Email              |
+-----------+----------+----------+--------+------------+--------+-----------+--------------------+
| Shourya   | Sharma   | Street24 | Pune   | Maharastra | 400002 | 987654320 | shourya@gmail.com  |
| Shashank  | Tiwari   | Street35 | Mumbai | Maharastra | 400003 | 98765432  | shashank@gmail.com |
+-----------+----------+----------+--------+------------+--------+-----------+--------------------+
2 rows in set (0.03 sec)

UC6 RETRIEVE PERSON BELONGING TO CITY OR STATE

mysql> SELECT FirstName FROM addressbook_system WHERE City='Pune';
+-----------+
| FirstName |
+-----------+
| Shourya   |
+-----------+
1 row in set (0.00 sec)

UC7 SIZE OF ADDRESS BOOK BY CITY OR STATE

mysql> SELECT COUNT(*) FROM addressbook_system WHERE City='Mumbai';
+----------+
| COUNT(*) |
+----------+
|        1 |
+----------+
1 row in set (0.14 sec)

UC8 SORT ALPHABETICALLY PERSON'S NAME BY CITY

mysql> SELECT FirstName FROM addressbook_system ORDER BY City ASC;
+-----------+
| FirstName |
+-----------+
| Shashank  |
| Shourya   |
+-----------+
2 rows in set (0.09 sec)

UC9 IDENTIFY WITH NAME OR TYPE

mysql> INSERT INTO addressbook_system
    -> ( FirstName, LastName, Address, City, State, Zip, PhoneNo, Email, Name, Type) VALUES ('Shashank','Tiwari','Street35','Mumbai','Maharastra',400003, 98765432, 'shashank@gmail.com' , 'Male', 'Family');
Query OK, 1 row affected (0.24 sec)
mysql> SELECT * FROM addressbook_system WHERE FirstName='Shashank';
+-----------+----------+----------+--------+------------+--------+----------+--------------------+------+--------+
| FirstName | LastName | Address  | City   | State      | Zip    | PhoneNo  | Email              | Name | Type   |
+-----------+----------+----------+--------+------------+--------+----------+--------------------+------+--------+
| Shashank  | Tiwari   | Street35 | Mumbai | Maharastra | 400003 | 98765432 | shashank@gmail.com | NULL | NULL   |
| Shashank  | Tiwari   | Street35 | Mumbai | Maharastra | 400003 | 98765432 | shashank@gmail.com | Male | Family |
+-----------+----------+----------+--------+------------+--------+----------+--------------------+------+--------+
2 rows in set (1.55 sec)

UC10 GET NUMBER OF CONTACTS I.E. COUNT BY TYPE


mysql> SELECT Type, count(*) as 'FirstName'
    -> from addressbook_system
    -> group by type;
+--------+-----------+
| Type   | FirstName |
+--------+-----------+
| NULL   |         2 |
| Family |         1 |
+--------+-----------+
2 rows in set (4.65 sec)

UC 11 - ADDING PERSON TO BOTH FRIEND AND FAMILY 

mysql> INSERT INTO addressbook_system VALUES
    -> ('Shruti','Sharma','Street14','Raipur','Chattisgrah',400008,987654321,'shruti@gmail.com','Female','Friend'),
    -> ('Soumya','Agrawal','Street21','Panji','Goa',400005,987654321,'soumya@gmail.com','Female','Family'),
    -> ('Akash','Tripathi','Street78','Lucknow','UP',400003,87654032,'akash@gmail.com','Male','Friend'),
    -> ('Simran','Kaur','Street98','Puri','Orissa',400001,875687435,'simran@gmail.com','Female','Family'),
    -> ('Shubhi','Agrawal','Street67','Vellore','Tamilnadu',400006,4567839905,'shubhi@gmail.com','Female','Friend');
Query OK, 5 rows affected (2.19 sec)
Records: 5  Duplicates: 0  Warnings: 0

mysql> SELECT * FROM addressbook_system;
+-----------+----------+----------+---------+-------------+--------+------------+--------------------+--------+--------+
| FirstName | LastName | Address  | City    | State       | Zip    | PhoneNo    | Email              | Name   | Type   |
+-----------+----------+----------+---------+-------------+--------+------------+--------------------+--------+--------+
| Shourya   | Sharma   | Street24 | Pune    | Maharastra  | 400002 | 987654320  | shourya@gmail.com  | NULL   | NULL   |
| Shashank  | Tiwari   | Street35 | Mumbai  | Maharastra  | 400003 | 98765432   | shashank@gmail.com | NULL   | NULL   |
| Shashank  | Tiwari   | Street35 | Mumbai  | Maharastra  | 400003 | 98765432   | shashank@gmail.com | Male   | Family |
| Shruti    | Sharma   | Street14 | Raipur  | Chattisgrah | 400008 | 987654321  | shruti@gmail.com   | Female | Friend |
| Soumya    | Agrawal  | Street21 | Panji   | Goa         | 400005 | 987654321  | soumya@gmail.com   | Female | Family |
| Akash     | Tripathi | Street78 | Lucknow | UP          | 400003 | 87654032   | akash@gmail.com    | Male   | Friend |
| Simran    | Kaur     | Street98 | Puri    | Orissa      | 400001 | 875687435  | simran@gmail.com   | Female | Family |
| Shubhi    | Agrawal  | Street67 | Vellore | Tamilnadu   | 400006 | 4567839905 | shubhi@gmail.com   | Female | Friend |
+-----------+----------+----------+---------+-------------+--------+------------+--------------------+--------+--------+
8 rows in set (0.08 sec)

UC12 - IMPLEMENTING ER DIAGRAM

 create table addressbook_id_table
    -> (
    -> book_id integer primary key NOT NULL,
    -> book_name varchar(20)
    -> );
Query OK, 0 rows affected (4.78 sec)

describe addressbook_id_table;
+-----------+-------------+------+-----+---------+-------+
| Field     | Type        | Null | Key | Default | Extra |
+-----------+-------------+------+-----+---------+-------+
| book_id   | int         | NO   | PRI | NULL    |       |
| book_name | varchar(20) | YES  |     | NULL    |       |
+-----------+-------------+------+-----+---------+-------+
2 rows in set (0.04 sec)

mysql> insert into addressbook_id_table values (101,'Book1'),(102,'Book2'),(103,'Book3');
Query OK, 3 rows affected (0.15 sec)
Records: 3  Duplicates: 0  Warnings: 0

mysql> select * from addressbook_id_table;
+---------+-----------+
| book_id | book_name |
+---------+-----------+
|     101 | Book1     |
|     102 | Book2     |
|     103 | Book3     |
+---------+-----------+
3 rows in set (0.00 sec)

mysql>  CREATE TABLE addressbook_system
    ->     (
    ->      FirstName        VARCHAR(150) NOT NULL,
    ->      LastName         VARCHAR(150) NOT NULL,
    ->      Address          VARCHAR(150) NOT NULL,
    ->     City             VARCHAR(150) NOT NULL,
    ->      State            VARCHAR(150) NOT NULL,
    ->     Zip              INT NOT NULL,
    ->      PhoneNo          VARCHAR(15) NOT NULL,
    ->      Email            VARCHAR(150) PRIMARY KEY NOT NULL,
    ->      Book_id      INT NOT NULL,
    ->      FOREIGN KEY (Book_id) references addressbook_id_table(book_id)
    ->     );
Query OK, 0 rows affected (4.03 sec)

mysql> describe addressbook_system;
+-----------+--------------+------+-----+---------+-------+
| Field     | Type         | Null | Key | Default | Extra |
+-----------+--------------+------+-----+---------+-------+
| FirstName | varchar(150) | NO   |     | NULL    |       |
| LastName  | varchar(150) | NO   |     | NULL    |       |
| Address   | varchar(150) | NO   |     | NULL    |       |
| City      | varchar(150) | NO   |     | NULL    |       |
| State     | varchar(150) | NO   |     | NULL    |       |
| Zip       | int          | NO   |     | NULL    |       |
| PhoneNo   | varchar(15)  | NO   |     | NULL    |       |
| Email     | varchar(150) | NO   | PRI | NULL    |       |
| Book_id   | int          | NO   | MUL | NULL    |       |
+-----------+--------------+------+-----+---------+-------+
9 rows in set (0.13 sec)

mysql> INSERT INTO addressbook_system (FirstName, LastName, Address, City, State, Zip, PhoneNo, Email, Book_id) VALUES
    ->     ( 'Amit','Sharma','Street23','Chandigarh','Punjab',400001,946789912,'amit@gmail',101),
    ->     ('Shourya','Sharma','Street24','Pune','Maharastra',400002,987654320,'shourya@gmail.com',101),
    ->     ('Shashank','Tiwari','Street35','Mumbai','Maharastra',400003,98765432,'shashank@gmail.com',103);
Query OK, 3 rows affected (0.24 sec)
Records: 3  Duplicates: 0  Warnings: 0

mysql> select * from addressbook_system;
+-----------+----------+----------+------------+------------+--------+-----------+--------------------+---------+
| FirstName | LastName | Address  | City       | State      | Zip    | PhoneNo   | Email              | Book_id |
+-----------+----------+----------+------------+------------+--------+-----------+--------------------+---------+
| Amit      | Sharma   | Street23 | Chandigarh | Punjab     | 400001 | 946789912 | amit@gmail         |     101 |
| Shashank  | Tiwari   | Street35 | Mumbai     | Maharastra | 400003 | 98765432  | shashank@gmail.com |     103 |
| Shourya   | Sharma   | Street24 | Pune       | Maharastra | 400002 | 987654320 | shourya@gmail.com  |     101 |
+-----------+----------+----------+------------+------------+--------+-----------+--------------------+---------+
3 rows in set (0.07 sec)